{
  "schemaVersion": 1,
  "id": "next-supabase-default-council",
  "stack": "next-supabase",
  "required": true,
  "defaultWorkflow": "planning",
  "principle": "Planner routes work by default; Lead Architect convenes council for core changes before implementation.",
  "agents": [
    {
      "id": "planner",
      "name": "Planner",
      "file": ".agent-kit/agents/planner.md",
      "defaultFor": ["planning", "roadmap", "scope", "ambiguous-request", "handoff"],
      "skills": ["planning-council", "best-practice-maturity-review", "agent-handoff-tracing", "docs-maintainer", "upgrade-maintenance"],
      "handsOffTo": ["lead-architect", "frontend-design-lead", "qa-engineer", "docs-maintainer"]
    },
    {
      "id": "lead-architect",
      "name": "Lead Architect",
      "file": ".agent-kit/agents/lead-architect.md",
      "defaultFor": ["core-change", "architecture", "cross-layer-change", "technical-decision"],
      "skills": [
        "planning-council",
        "best-practice-maturity-review",
        "agent-handoff-tracing",
        "nextjs-app-router",
        "supabase-auth-rls",
        "postgres-migrations",
        "owasp-security-review",
        "upgrade-maintenance"
      ],
      "handsOffTo": ["supabase-postgres-engineer", "nextjs-engineer", "security-reviewer", "qa-engineer", "docs-maintainer"]
    },
    {
      "id": "supabase-postgres-engineer",
      "name": "Supabase/Postgres Engineer",
      "file": ".agent-kit/agents/supabase-postgres-engineer.md",
      "defaultFor": ["schema", "migration", "rls", "auth", "storage", "sql"],
      "skills": ["supabase-auth-rls", "postgres-migrations", "owasp-security-review"],
      "handsOffTo": ["security-reviewer", "qa-engineer", "docs-maintainer", "deployment-observability-engineer"]
    },
    {
      "id": "nextjs-engineer",
      "name": "Next.js Engineer",
      "file": ".agent-kit/agents/nextjs-engineer.md",
      "defaultFor": ["app-router", "server-components", "route-handler", "server-action", "forms", "ui-state"],
      "skills": ["nextjs-app-router", "content-first-design", "frontend-design-system", "accessibility-wcag", "testing-qa"],
      "handsOffTo": ["frontend-design-lead", "security-reviewer", "qa-engineer", "docs-maintainer"]
    },
    {
      "id": "frontend-design-lead",
      "name": "Frontend Design Lead",
      "file": ".agent-kit/agents/frontend-design-lead.md",
      "defaultFor": [
        "brand-content-intake",
        "creative-direction",
        "reference-led-critique",
        "distinctiveness-benchmark",
        "product-quality-scorecard",
        "visual-design",
        "component-system",
        "visual-regression",
        "accessibility",
        "anti-generic-ui",
        "screenshot-review"
      ],
      "skills": [
        "content-first-design",
        "reference-led-design-critique",
        "frontend-distinctiveness-benchmark",
        "frontend-product-quality-rubric",
        "frontend-design-system",
        "ui-improvement-harness",
        "visual-regression-qa",
        "accessibility-wcag"
      ],
      "handsOffTo": ["marketing-copy-lead", "nextjs-engineer", "qa-engineer", "docs-maintainer"]
    },
    {
      "id": "marketing-copy-lead",
      "name": "Marketing Copy Lead",
      "file": ".agent-kit/agents/marketing-copy-lead.md",
      "defaultFor": [
        "copy",
        "copywriting",
        "marketing",
        "positioning",
        "messaging",
        "value-proposition",
        "landing-page-copy",
        "headline",
        "cta",
        "conversion",
        "onboarding-copy",
        "empty-state-copy",
        "voice-tone",
        "pricing-copy"
      ],
      "skills": ["positioning-messaging", "conversion-copywriting", "landing-page-copy", "product-voice-tone", "onboarding-empty-state-copy"],
      "handsOffTo": ["frontend-design-lead", "nextjs-engineer", "qa-engineer", "docs-maintainer"]
    },
    {
      "id": "security-reviewer",
      "name": "Security Reviewer",
      "file": ".agent-kit/agents/security-reviewer.md",
      "defaultFor": ["security-review", "auth-boundary", "data-mutation", "external-call", "dependency", "secret"],
      "skills": ["owasp-security-review", "supabase-auth-rls", "postgres-migrations"],
      "handsOffTo": ["lead-architect", "qa-engineer", "docs-maintainer", "deployment-observability-engineer"]
    },
    {
      "id": "qa-engineer",
      "name": "QA Engineer",
      "file": ".agent-kit/agents/qa-engineer.md",
      "defaultFor": ["testing", "regression", "smoke", "acceptance-evidence", "test", "review", "code-review"],
      "skills": ["testing-qa", "best-practice-maturity-review", "visual-regression-qa", "accessibility-wcag"],
      "handsOffTo": ["docs-maintainer", "deployment-observability-engineer"]
    },
    {
      "id": "docs-maintainer",
      "name": "Documentation Maintainer",
      "file": ".agent-kit/agents/docs-maintainer.md",
      "defaultFor": ["docs", "decisions", "spec", "style-guide", "roadmap", "upgrade-evidence"],
      "skills": ["docs-maintainer", "planning-council", "best-practice-maturity-review", "agent-handoff-tracing", "upgrade-maintenance"],
      "handsOffTo": ["deployment-observability-engineer"]
    },
    {
      "id": "deployment-observability-engineer",
      "name": "Deployment/Observability Engineer",
      "file": ".agent-kit/agents/deployment-observability-engineer.md",
      "defaultFor": ["release", "deployment", "environment", "logs", "rollback", "monitoring"],
      "skills": ["deployment-observability", "testing-qa", "upgrade-maintenance"],
      "handsOffTo": ["qa-engineer", "docs-maintainer"]
    }
  ],
  "workflows": [
    {
      "id": "planning",
      "triggers": ["plan", "roadmap", "phase", "scope", "spec", "specification", "acceptance criteria", "what should we do", "break this down"],
      "sequence": ["planner", "lead-architect", "qa-engineer", "docs-maintainer"],
      "council": ["planner", "lead-architect"],
      "requiredOutputs": ["phased checklist", "maturity target", "affected layers", "preserved capabilities", "verification plan", "docs impact"]
    },
    {
      "id": "core-change",
      "triggers": [
        "schema",
        "auth",
        "rls",
        "api",
        "route handler",
        "server action",
        "dependency",
        "upgrade",
        "release workflow",
        "package behavior",
        "cross-layer"
      ],
      "sequence": [
        "planner",
        "lead-architect",
        "supabase-postgres-engineer",
        "nextjs-engineer",
        "security-reviewer",
        "qa-engineer",
        "docs-maintainer",
        "deployment-observability-engineer"
      ],
      "council": ["lead-architect", "security-reviewer", "qa-engineer", "docs-maintainer"],
      "requiredOutputs": [
        "architecture decision",
        "maturity evidence",
        "security review",
        "test evidence",
        "doc updates",
        "upgrade evidence when applicable",
        "release or rollback notes"
      ]
    },
    {
      "id": "frontend-change",
      "triggers": ["screen", "component", "layout", "design", "responsive", "accessibility", "screenshot", "ui audit", "ui polish", "browser qa"],
      "sequence": ["planner", "frontend-design-lead", "marketing-copy-lead", "nextjs-engineer", "qa-engineer", "docs-maintainer"],
      "council": ["frontend-design-lead", "marketing-copy-lead", "qa-engineer"],
      "requiredOutputs": [
        "brand/content intake",
        "copy/value-proposition brief when public-facing or conversion-facing",
        "creative-direction rationale",
        "reference-set evidence",
        "distinctiveness benchmark",
        "design critique verdict",
        "frontend product-quality scorecard",
        "domain-specific UI rationale",
        "UI detector findings and severity",
        "UI command workflow applied when polishing or auditing",
        "visual QA evidence",
        "state coverage",
        "accessibility checks",
        "desktop/mobile verification",
        "authenticated screen evidence when applicable"
      ]
    },
    {
      "id": "marketing-copy",
      "triggers": [
        "copy",
        "copywriting",
        "marketing",
        "positioning",
        "messaging",
        "value prop",
        "value proposition",
        "landing page",
        "headline",
        "cta",
        "conversion",
        "onboarding",
        "empty state",
        "pricing"
      ],
      "sequence": ["planner", "marketing-copy-lead", "frontend-design-lead", "qa-engineer", "docs-maintainer"],
      "council": ["marketing-copy-lead", "frontend-design-lead"],
      "requiredOutputs": [
        "discovery questions answered or explicitly marked unknown",
        "audience and segment assumptions",
        "problem, pain, desired outcome, and value proposition",
        "differentiators, proof points, objections, and counter-messaging",
        "voice/tone guidance",
        "page or flow copy inventory",
        "CTA and conversion hypothesis",
        "handoff notes for design and implementation"
      ]
    },
    {
      "id": "testing",
      "triggers": ["test", "tests", "unit test", "regression test", "smoke test", "playwright", "acceptance test"],
      "sequence": ["qa-engineer", "docs-maintainer"],
      "council": ["qa-engineer"],
      "requiredOutputs": ["test plan", "commands run", "pass/fail summary", "coverage gaps", "skipped-test rationale"]
    },
    {
      "id": "code-review",
      "triggers": ["review", "code review", "pre-merge", "pr review", "merge review"],
      "sequence": ["qa-engineer", "security-reviewer", "docs-maintainer"],
      "council": ["qa-engineer", "security-reviewer"],
      "requiredOutputs": ["reviewed scope", "findings by severity", "required fixes", "security notes when applicable", "merge recommendation"]
    },
    {
      "id": "security-review",
      "triggers": ["security", "owasp", "secret", "token", "permission", "ssrf", "idor", "dependency"],